{
  "$schema": "../../../../../schemas/font-decision.schema.json",
  "schemaVersion": "1.0.0",
  "id": "IOS-004-FONT-DECISION",
  "status": "pending-human-decision",
  "selectedCandidate": null,
  "candidates": [
    {
      "id": "inter",
      "name": "Inter",
      "category": "product-sans",
      "readability": "strong",
      "licensing": "upstream-ofl-1.1-review-pending",
      "webDelivery": "available-strategy-pending",
      "nativeCompatibility": "fallback-required",
      "variableFont": "available-unapproved",
      "languageCoverage": "requires-target-locale-verification",
      "fileSize": "requires-approved-subset-and-style-budget",
      "brandFit": "neutral-technical-candidate",
      "figmaAvailability": "pending-human-verification",
      "source": "https://github.com/rsms/inter"
    },
    {
      "id": "system-ui",
      "name": "System UI stack",
      "category": "system-sans",
      "readability": "strong-platform-dependent",
      "licensing": "platform-terms-no-bundled-file",
      "webDelivery": "no-font-download",
      "nativeCompatibility": "strong-platform-variance",
      "variableFont": "platform-dependent",
      "languageCoverage": "platform-dependent",
      "fileSize": "no-network-font-cost",
      "brandFit": "neutral-low-differentiation",
      "figmaAvailability": "not-losslessly-representable-as-one-family",
      "source": "https://www.w3.org/TR/css-fonts-4/"
    },
    {
      "id": "ibm-plex-sans",
      "name": "IBM Plex Sans",
      "category": "enterprise-sans-alternative",
      "readability": "strong-enterprise-candidate",
      "licensing": "upstream-ofl-1.1-review-pending",
      "webDelivery": "available-strategy-pending",
      "nativeCompatibility": "fallback-required",
      "variableFont": "candidate-capability-requires-version-verification",
      "languageCoverage": "broad-script-packages-require-product-scope",
      "fileSize": "potentially-high-for-multi-script-delivery",
      "brandFit": "technical-with-brand-association",
      "figmaAvailability": "pending-human-verification",
      "source": "https://github.com/IBM/plex"
    },
    {
      "id": "source-sans-3",
      "name": "Source Sans 3",
      "category": "humanist-sans-alternative",
      "readability": "strong-ui-candidate",
      "licensing": "upstream-ofl-1.1-review-pending",
      "webDelivery": "available-strategy-pending",
      "nativeCompatibility": "fallback-required",
      "variableFont": "available-unapproved",
      "languageCoverage": "requires-target-locale-verification",
      "fileSize": "requires-approved-subset-and-style-budget",
      "brandFit": "humanist-neutral-candidate",
      "figmaAvailability": "pending-human-verification",
      "source": "https://github.com/adobe-fonts/source-sans"
    },
    {
      "id": "jetbrains-mono",
      "name": "JetBrains Mono",
      "category": "monospace-candidate",
      "readability": "strong-code-candidate",
      "licensing": "upstream-ofl-1.1-review-pending",
      "webDelivery": "available-strategy-pending",
      "nativeCompatibility": "fallback-required",
      "variableFont": "available-unapproved",
      "languageCoverage": "requires-code-and-target-locale-verification",
      "fileSize": "requires-approved-subset-and-style-budget",
      "brandFit": "developer-forward-code-only",
      "figmaAvailability": "pending-human-verification",
      "source": "https://github.com/JetBrains/JetBrainsMono"
    }
  ],
  "humanDecisions": [
    "primary-product-sans",
    "exact-font-version",
    "delivery-and-font-display-policy",
    "license-and-redistribution-approval",
    "fallback-order-and-metric-adjustment",
    "language-and-script-coverage",
    "weights-italics-and-variable-axes",
    "monospace-and-ligature-policy",
    "numeric-feature-defaults",
    "figma-source-and-style-names",
    "file-size-budget"
  ],
  "approvals": {
    "design": "pending",
    "engineering": "pending-specialist-review",
    "accessibility": "pending-specialist-review",
    "licensing": "pending",
    "independentRelease": "pending"
  }
}
